Abbrevation_internal	Abbrevation	OPC_molecular_subtype	Color_code	Molecular_superfamily	Molecular_family	Molecular_class	Molecular_subclass	description
GBM_IDH	A_IDH_HG	HGG, IDH	#DDCA11	Adult-type diffuse gliomas	diffuse glioma, IDH mutant	diffuse glioma, IDH-mutant and 1p19q retained [astroglial type], high grade	Astrocytoma, IDH-mutant; high grade	The "mc Astrocytoma, IDH-mutant; high grade" is comprised of diffusely infiltrating IDH1- or IDH2-mutant gliomas with frequent ATRX and/or TP53 mutation and absence of 1p/19q codeletion. Complete 1p/19q codeletion is not compatible with "IDH glioma, subclass astrocytoma" and if present should lead to diagnosis of an "IDH glioma, subclass 1p/19q codeleted oligodendroglioma". This mc is strongly enriched for CNS WHO grade 4 tumours, in contrast to the "mc astrocytoma, IDH-mutant; lower grade", which is enriched for CNS WHO grade 2 malignancies. Astrocytomas with IDH1 or IDH2 mutation can be located in any region of the CNS, including the brainstem and spinal cord, but they most commonly develop in the supratentorial compartment and are usually centred near or within the frontal lobes. The majority of patients present in their thirties or forties (median age: 38 years) with CNS WHO grade 2 or 3 tumours { 26061751 ; 25962792 }. CNS WHO grade 2 and 3 astrocytomas have similar age distributions, whereas patients with CNS WHO grade 4 tumours tend to be slightly older.
A_IDH	A_IDH_LG	LGG, IDH	#ECBF00	Adult-type diffuse gliomas	diffuse glioma, IDH mutant	diffuse glioma, IDH-mutant and 1p19q retained [astroglial type]	Astrocytoma, IDH-mutant; lower grade	The "mc astrocytoma, IDH-mutant; lower grade" mainly comprises tumours with astrocytic histology of WHO grades 2 and 3. This class universally harbors mutations of either IDH1 or IDH2 and the associated glioma CIMP phenotype. Tumours of this class usually have a supratentorial location but may also arise infratentorially; median age is 35 years (range 16 to 71). Complete 1p/19q codeletion is not compatible with "IDH glioma, subclass astrocytoma" and if present should lead to diagnosis of an "IDH glioma, subclass 1p/19q codeleted oligodendroglioma" despite a possibly higher classifier score for astrocytoma.
HGNET_MN1	ABM_MN1	CNS HGNET-MN1	#AB94C1	high-grade neuroepithelial tumour with MN1:BEND2 fusion	high-grade neuroepithelial tumour with MN1:BEND2 fusion	high-grade neuroepithelial tumour with MN1:BEND2 fusion	Astroblastoma, MN1-altered, MN1:BEND2-fused	The "mc Astroblastoma, MN1-altered, MN1:BEND2-fused" is comprised of circumscribed glial neoplasms with MN1 alteration that are typically composed of round, cuboidal, or columnar cells with variable pseudopapillary or perivascular growth, perivascular anucleate zones, and vascular and pericellular hyalinization. However, divergent histologies have also commonly been observed in this mc. tumours occur predominantly in the cerebral hemispheres, most often in the frontal and parietal lobes, but also in occipital and temporal regions. Patient ages range from 3 months to 40 years at clinical presentation (median: 15 years) .
LGG_MYB_A	AG_MYB	LGG, MYB/MYBL1	#9159DE	Low-grade glial/glioneuronal/neuroepithelial tumours	diffuse glioma, MYB- or MYBL1-altered	diffuse glioma, MYB(L1)-altered, subtype A [angiocentric glioma-type]	Angiocentric glioma, MYB/MYBL1-altered	The "mc angiocentric glioma, MYB/MYBL1-altered" mainly comprises tumours with the histological diagnosis of angiocentric glioma and to a lesser extent other low grade gliomas or glioneuronal tumours like dysembryoplastic neuroepithelial tumours and gangliogliomas. Location is mostly supratentorial, but some cases in the posterior fossa are also included; median age is 16 years (range 3 to 70). Molecularly, these tumours show a high rate of rearrangements of MYB (particularly MYB:QKI fusions) or MYBL1. Around 25% of cases show a partial loss of chromosome 6 involving the MYB gene. Besides this most cases show a flat profile in copy number analysis.
ANTCON	ANTCON		#ff9e4d	Adult-type diffuse gliomas	diffuse high-grade neuroepithelial tumour [adult-type]	anaplastic neuroepithelial tumour with condensed nuclei	Anaplastic neuroepithelial tumour with condensed nuclei	The "mc anaplastic neuroepithelial tumour with condensed nuclei" is a new tumor molecularly rendered tumor group. Data on clinical presentation and outcome is still being gathered. More than half of these tumors harbour gene fusions, mostly including NTRK.
RMS_alevolar	ARMS			rhabdomyosarcoma	alveolar rhabdomyosarcoma	rhabdomyosarcoma, alveolar subtype	Rhabdomyosarcoma, alveolar subtype	The "mc Rhabdomyosarcoma, alveolar subtype" represents a malignant tumour with histological features of primitive round cells and skeletal muscle differentiation. These tumours display either a PAX3:FOXO1 or PAX7:FOXO1 fusion. Peak incidence is between 10-25 years of age. This tumour is rarely, if at all, encountered in the CNS, and is included to give a better distinction for other sarcoma types that can occur intracranially.
ATRT_MYC	ATRT_MYC	ATRT, MYC	#006EAD	Other CNS embryonal tumours	Atypical teratoid rhabdoid tumour	Atypical teratoid rhabdoid tumour, MYC activated	Atypical teratoid rhabdoid tumour, MYC activated	The "mc atypical teratoid/rhabdoid tumour, MYC-subtype" exclusively comprises tumours with atypical teratoid/rhabdoid histology, although rhabdoid cells may be scarce in some instances. A supratentorial location is more common than infratentorial; median age is 2 years (range 0 to 25). Molecularly, virtually all cases show loss of INI1 (SMARCB1) protein, and this subtype shows activation of the MYC oncogene. Loss of SMARCB1 (either focal or as part of a larger deletion) is detectable in over 90% of cases by copy number analysis.
ATRT_SHH	ATRT_SHH	ATRT, SHH	#009CEA	Other CNS embryonal tumours	Atypical teratoid rhabdoid tumour	Atypical teratoid rhabdoid tumour, SHH activated	Atypical teratoid rhabdoid tumour, SHH activated	The "mc atypical teratoid rhabdoid tumour, SHH-subtype" exclusively comprises tumours with atypical teratoid/rhabdoid histology, although rhabdoid cells may be scarce in some instances. Supratentorial and infratentorial locations are equally likely; median age is 2 years (range 0 to 11). Molecularly, virtually all cases show loss of INI1 (SMARCB1) protein, and this subtype shows SHH pathway activation. Loss of SMARCB1 (in most cases as part of a chromosome 22 loss) is detectable in around 50% of cases by copy number analysis.
ATRT_TYR	ATRT_TYR	ATRT, TYR	#44AEFF	Other CNS embryonal tumours	Atypical teratoid rhabdoid tumour	Atypical teratoid rhabdoid tumour, Tyrosinase activated	Atypical teratoid rhabdoid tumour, Tyrosinase activated	The "mc atypical l teratoid rhabdoid tumour, TYR-subtype" exclusively comprises tumours with atypical teratoid/rhabdoid histology, although rhabdoid cells may be scarce in some instances. An infratentorial location is more common than supratentorial; median age is 1 year (range 0 to 9). Molecularly, virtually all cases show loss of INI1 (SMARCB1) protein, and many cases of this subtype show strong tyrosinase expression (mRNA & protein). Loss of chromosome 22 is observed in over 80% of cases by copy number analysis.
PGG	CAUDEQU_NET		#F5811D	Cranial and paraspinal nerve tumours	Cauda equina neuroendocrine tumour [paraganglioma]	Cauda equina neuroendocrine tumour [paraganglioma], subtype non-CIMP	Cauda equina neuroendocrine tumour [paraganglioma], subtype non-CIMP	The "mc Cauda equina neuroendocrine tumour" (previously Paraganglioma) represents a neuroendocrine neoplasm arising from specialized neural crest cells in the cauda equina / filum terminale region. The tumours in this mc do not show the CIMP phenotype due to SDH mutation seen in some paragangliomas/phaeochromocytomas arising in other locations. Most tumours show a flat copy number profile, and no recurrent genetic driver has been identified to date. These tumours are typically intradural, and are attached to the fiulm terminale or occaisonally a caudal nerve root. Peak incidence is in the fourth to sixth decade of life, with a slight preponderance in male patients (M:F ratio 1.5:1)
CHD3V	CHGL		#B37DEC	Circumscribed astrocytic tumours	chordoid glioma	chordoid glioma	Chordoid glioma, PRKCA-mutant	The " mc chordoid glioma, PRKCA-mutant " exclusively comprises tumours with the histological diagnosis chordoid glioma of the third ventricle. Location of all cases is in or around the third ventricle; median age is 47 years (range 26 to 61). Additional characteristic molecular features of this class are not known to date. Recurrent chromosomal alterations are not observed and most cases show a flat profile in copy number analysis.
CHORDM	CHORDM		#FA8CFF	Mesenchymal, non-meningothelial tumours involving the CNS	Notochordal tumours	chordoma	Chordoma	The "mc chordoma" exclusively comprises tumours with the histological diagnosis chordoma. The most frequent locations are suprasellar and around the clivus. Median age is 37 years (range 14 to 71). Additional characteristic molecular features of this class are not known to date. Numeric chromosomal alteration are frequent, with over 50% of cases showing gain of chromosome 7 and/or loss of Chromosome 3p, 13 and 14.
CN	CN	CNC	#B85400	central neurocytoma	central neurocytoma	central neurocytoma	Central neurocytoma	The "mc central neurocytoma”" is exclusively comprised of tumours with the histological diagnosis central neurocytoma. A distinction between central neurocytoma and atypical central neurocytoma is currently not possible based on methylation profiling. Most frequent location is the lateral ventricle; median age is 27 years (range 14 to 70). Recurrent chromosomal alterations are not observed and most cases show a flat profile in copy number analysis.
EP300_BCOR	CNS_BCOR_FUS		#5987c0	Other CNS embryonal tumours	CNS BCOR-altered tumours	CNS tumour with EP300:BCOR(L1) fusion	CNS tumour with EP300:BCOR(L1) fusion	The "mc CNS tumour with BCOR/BCORL1 fusion" is a new methylation class. Pathological , clinical and further molecular evaluation is under investigation.
HGNET_BCOR	CNS_BCOR_ITD	CNS BCOR	#739ACA	Other CNS embryonal tumours	CNS BCOR-altered tumours	neuroepithelial tumour with BCOR internal tandem duplication	CNS tumour with BCOR internal tandem duplication	The "mc CNS Tumour with BCOR internal tandem duplication" comprised malignant CNS tumours characterized by a predominantly solid growth pattern, uniform oval or spindle-shaped cells with round to oval nuclei, a dense capillary network, focal pseudorosette formation, and an ITD in exon 15 of the BCOR gene. The median age at presentation of reported patients is 3.5 years (range: 0–22 years). These tumours most commonly occur in a cerebral or cerebellar hemisphere.
CNS_NB_FOXR2	CNS_NB_FOXR2	CNS NB-FOXR2	#518ccb	Other CNS embryonal tumours	CNS neuroblastoma, FOXR2-altered	CNS neuroblastoma, FOXR2-altered	CNS neuroblastoma, FOXR2-altered	The "mc CNS neuroblastoma, FOXR2-activated" typically displays embryonal histology and a small-cell phenotype. All tumours have a supratentorial location; median age is 6 years (range 2 to 16). Gain of chromosome 1q (>80%) and focal or total loss of 16q (>60%) are characteristic copy-number alterations. Molecularly, these tumours show activation of transcription factor FOXR2 by various structural rearrangements.
EFT_CIC	CNS_SARC_CIC		#955C9D	Mesenchymal, non-meningothelial tumours involving the CNS	Tumours of uncertain differentiation	CIC-rearranged sarcoma	CIC-rearranged sarcoma	The "mc CIC rearranged sarcoma" corresponds to  CIC-rearranged sarcoma preferably arising in adolescents and young adults. Different fusion partners with CIC may account for subtypes of this tumor type.
CNS_SCS_DICER	CNS_SARC_DICER		#cb61eb	Mesenchymal, non-meningothelial tumours involving the CNS	Tumours of uncertain differentiation	Primary intracranial sarcoma, DICER1-mutant	Primary intracranial sarcoma, DICER1-mutant	The "mc primary intracranial sarcoma, DICER1-mutant"  comprises intracranial tumours with the histological diagnosis of malignant CNS sarcoma / tumour not otherwise specified. Median age is 7 years (age range 0 to 76). The molecular hallmark of this class are DICER1 mutations (>90%), either somatic or inherited, often together with MAPK pathway alterations (>70%). Copy number profiles range from relatively flat to complex. Rhabdomyosarcoma of the genitourinary tract with DICER1 mutations may also assign to this methylation class.
VGLL	CNS_SCHW_VGLL		#ff904d	Cranial and paraspinal nerve tumours	schwann-cell tumours	CNS Schwannoma, VGLL-fused	CNS Schwannoma, VGLL-fused	The "mc CNS Schwannoma, VGLL-fused" represents a very rare group of intracranial tumours with morphological and immunohistochemical features of schwannoma. These tumours often display fusions of the VGLL gene family (VGLL2 or VGLL3), which have also been reported for a subset of peripheral schwannoma. This mc is a provisional class, which is still being further characterized.
CPC_B	CPC_AD		#86492d	choroid plexus tumours	choroid plexus tumours	choroid plexus carcinoma	Choroid plexus carcinoma, adult subtype	The "mf choroid plexus carcinoma," comprises the methylation classes "mc choroid plexus carcinoma, paediatric subtype" and  "mc choroid plexus carcinoma, adult subtype". Subtyping is under investigation.
CPC	CPC_PED		#754027	choroid plexus tumours	choroid plexus tumours	choroid plexus carcinoma	Choroid plexus carcinoma, pediatric subtype	The "mf choroid plexus carcinoma," comprises the methylation classes "mc choroid plexus carcinoma, paediatric subtype" and  "mc choroid plexus carcinoma, adult subtype". Subtyping is under investigation.
CPH_ADM	CPH_ADM	CRANIO, ADAM	#72D4C8	tumours of the sellar region	craniopharyngioma	adamantinomatous craniopharyngioma	Adamantinomatous craniopharyngioma	The "mc adamantinomatous craniopharyngioma" exclusively comprises tumors with the histological diagnosis of adamantinomatous craniopharyngioma. These tumors are located in the vicinity of the pituitary gland. There is a bimodal age distribution, with peaks in early childhood and at around 50 years of age; median age is 37 years (range 3 to 66). Molecularly, these tumors are characterized by mutations in beta catenin (CTNNB1) and activation of the WNT and SHH signaling pathways. Recurrent chromosomal alterations are not observed and most cases show a flat profile in copy number analysis.
CPH_PAP	CPH_PAP		#43DAD7	tumours of the sellar region	craniopharyngioma	papillary craniopharyngioma	Papillary craniopharyngioma	The "mc papillary craniopharyngioma" exclusively comprises tumors with the histological diagnosis of papillary craniopharyngioma. These tumors are located in the vicinity of the pituitary gland; median age is 46.5 years (range 23 to 69). Molecularly, these tumors are characterized by mutations in BRAF (V600E) and activation of the MAPK signaling pathway. Recurrent chromosomal alterations are not observed and most cases show a flat profile in copy number analysis. Prediction of "mc craniopharyngioma, papillary" should be based on a calibrated score > 0.95.
CPP_AD	CPP_AD		#7B3E0A	choroid plexus tumours	choroid plexus tumours	choroid plexus papilloma	Choroid plexus papilloma, adult subtype	The "mf choroid plexus papilloma," comprises the methylation classes "mc choroid plexus papilloma, adult subtype" and  "mc choroid plexus papilloma, paediatric subtype". Subtyping is under investigation.
CPP_INF	CPP_PED		#9D5723	choroid plexus tumours	choroid plexus tumours	choroid plexus papilloma	Choroid plexus papilloma, pediatric subtype	The "mf choroid plexus papilloma," comprises the methylation classes "mc choroid plexus papilloma, adult subtype" and  "mc choroid plexus papilloma, paediatric subtype". Subtyping is under investigation.
CRINET	CRINET		#000066	Other CNS embryonal tumours	cribriform neuroepithelial tumour	cribriform neuroepithelial tumour	Cribriform neuroepithelial tumour	The "mc Cribriform neuroepithelial tumour" represents a non-rhabdoid neuroectodermal tumour, histologically showing cribriform strands and ribbons. These tumours show genetic inactivation of SMARCB1, including some cases with germline SMARCB1 alterations. The methylation profile of this mc is highly related to that of atypical teratoid / rhabdoid tumour. This mc is a provisional class, which is still being further characterized.
NORM_ADENOPIT	CTRL_ADENOPIT	NA	#D3D3D3	Control tissues	control brain tissues	Control tissue, pituitary gland (anterior lobe)	Control tissue, pituitary gland (anterior lobe)	The "msc ontrol tissue, pituitary gland anterior lobe" is comprised of normal tissue samples from this specific anatomic structure. In case tumour samples display this molecular pattern, it is typically an indication of low tumour cell content in the analyzed material and indicates that the extracted DNA is likely not suitable for classification by methylation profiling.
CTRL_BLOOD	CTRL_BLOOD	NA	#595959	Control tissues	control tissue, blood	control tissue, blood	Control tissue, blood	The "mc Control tissue, blood" represents the methylation profile of normal white blood cells.
NORM_CBM	CTRL_CBM	NA	#BDBDBD	Control tissues	control brain tissues	control tissue, cerebellar hemisphere	Control tissue, cerebellar hemisphere	The "msc control tissue, cerebellar hemisphere" is comprised of normal tissue samples from this specific anatomic structure. In case tumour samples display this molecular pattern, it is typically an indication of low tumour cell content in the analyzed material and indicates that the extracted DNA is likely not suitable for classification by methylation profiling.
NORM_CORPCAL	CTRL_CORPCAL	NA	#A8A8A8	Control tissues	control brain tissues	control tissue, white matter (corpus callosum)	Control tissue, white matter (corpus callosum)	The "msc control tissue, white matter" is comprised of normal tissue samples from this specific anatomic structure (corpus callosum). In case tumour samples display this molecular pattern, it is typically an indication of low tumour cell content in the analyzed material and indicates that the extracted DNA is likely not suitable for classification by methylation profiling.
NORM_HEMI	CTRL_HEMI	NA	#939393	Control tissues	control brain tissues	control tissue, hemispheric cortex	Control tissue, hemispheric cortex	The "msc control tissue, hemispheric cortex" is comprised of normal tissue samples from several different lobes of the cortex. In case tumour samples display this molecular pattern, it is typically an indication of low tumour cell content in the analyzed material and indicates that the extracted DNA is likely not suitable for classification by methylation profiling.
NORM_HYPOTHAL	CTRL_HYPOTHAL	NA	#7E7E7E	Control tissues	control brain tissues	control tissue, hypothalamus	Control tissue, hypothalamus	The "msc control tissue, hypothalamus" is comprised of normal tissue samples from this specific anatomic structure. In case tumour samples display this molecular pattern, it is typically an indication of low tumour cell content in the analyzed material and indicates that the extracted DNA is likely not suitable for classification by methylation profiling.
NORM_OPTIC	CTRL_OPTIC	NA	#a6a6a6	Control tissues	control brain tissues	control tissue, optic pathway	Control tissue, optic pathway	The "msc control tissue, optic pathway" is comprised of normal tissue samples from this specific anatomic structure. In case tumour samples display this molecular pattern, it is typically an indication of low tumour cell content in the analyzed material and indicates that the extracted DNA is likely not suitable for classification by methylation profiling.
NORM_PIN	CTRL_PIN	NA	#696969	pineal parenchymal and retinal tumour	normal pineal gland and pineocytoma	control tissue, pineal gland	Control tissue, pineal gland	The "msc control tissue, pineal gland" is comprised of normal tissue samples from this specific anatomic structure. In case tumour samples display this molecular pattern, it is typically an indication of low tumour cell content in the analyzed material and indicates that the extracted DNA is likely not suitable for classification by methylation profiling. For this mc specifically, epigenetic separation of pineocytoma and controll tissue, pineal gland may be challenging and imprecise.
NORM_PONS	CTRL_PONS	NA	#545454	Control tissues	control brain tissues	control tissue, pons	Control tissue, pons	The "msc control tissue, pons" is comprised of normal tissue samples from this specific anatomic structure. In case tumour samples display this molecular pattern, it is typically an indication of low tumour cell content in the analyzed material and indicates that the extracted DNA is likely not suitable for classification by methylation profiling.
GLIOMA_NORM_HI	CTRL_REACTIVE	NA	#D7D7D7	Control tissues	control tissue, reactive tumour microenvironment	control tissue, reactive tumour microenvironment	Control tissue, reactive tumour microenvironment	The "mc Control tissue, reactive tumour microenvironment" does not represent a distinct tumour class but rather a recurrently observed methylation profile of unclear status. A score for this class indicates that the extracted DNA is likely not suitable for classification by methylation profiling. The cases constituting this class are mostly low grade tumours (gangliogliomas or pilocytic astrocytomas) but also some high grade tumours. The cases share low tumour cell content and frequently show strong reactive changes (high proportion of reactive glial cell and frequently pronounced lymphocytic infiltration). Depending on the content of tumour cell, copy number alterations may be masked.
DGONC	DGONC	GNT	#ff701a	Low-grade glial/glioneuronal/neuroepithelial tumours	low-grade glioneuronal tumour	Diffuse glioneuronal tumour with oligodendroglioma-like features and nuclear clusters	Diffuse glioneuronal tumour with oligodendroglioma-like features and nuclear clusters	The "mc diffuse glioneuronal tumour with oligodendroglioma-like features and nuclear clusters (DGONC)" comprises tumours morphologically characterized by diffuse growth, frequently clear cell histology, and formation of clusters of nuclei, as described in PMID31867747 and 33325069. These tumours virtually all harbour monosomy of chromosome 14. The median age is 9 years, but cases up to an age of 75 years are reported.
GBM_G34	DHG_G34	HGG, H3 G35	#55C056	Paediatric-type diffuse high-grade gliomas	Diffuse pediatric-type high-grade glioma, H3-wildtype and IDH-wildtype	Diffuse hemispheric glioma, H3 G34-mutant	Diffuse hemispheric glioma, H3 G34-mutant	The "mc Diffuse hemispheric glioma, H3 G34-mutant"  is an infiltrative glioma (WHO grade IV) involving the cerebral hemispheres, with missense mutation of the H3-3A gene that results in one of the following substitutions of the histone H3 protein: c.103G>A p.G35R (G34R), c.103G>C p.G35R (G34R), or c.104G>T p.G35V (G34V). H3 G34–mutant diffuse hemispheric gliomas typically affect adolescents and young adults (median age:15–19 years). In addition to the histone mutation, about 90% of tumours bear TP53 mutations and approximately 95% have alterations in the ATRX gene.  Copy number changes are numerous, with gain of 1q and 7 (>40% of cases) and (focal) loss of 4q, 10q and 13 (each in over 40%) being most frequent.
DIG	DIG_DIA	GNT	#cd4d00	Low-grade glial/glioneuronal/neuroepithelial tumours	low-grade ganglioglial/neuroepithelial tumour	desmoplastic infantile ganglioglioma/astrocytoma	Desmoplastic infantile ganglioglioma / desmoplastic infantile astrocytoma	The "mc desmoplastic infantile ganglioglioma / desmoplastic infantile astrocytoma" mostly comprises tumors histologically resembling desmoplastic infantile gliomas. These tumors are located supratentorially, and patients are typically below 3 years of age at presentation; median age is 1 year (age range 0 to 11). Typical molecular features of this class are not currently known, although occasional BRAF V600E mutations have been reported. Recurrent chromosomal alterations are not observed and most cases show a flat profile in copy number analysis.
PCNSL_DLB	DLBCL		#3C1B46	Haematolymphoid tumours involving the CNS	B cell neoplasm	Primary diffuse large B cell lymphoma of the CNS	Primary diffuse large B cell lymphoma of the CNS	The "msc Primary diffuse large B cell lymphoma of the CNS" comprises brain manifestations of Diffuse large B-cell lymphoma. This class is included as a diagnostically relevant differential diagnosis to various brain tumours. Other types of lymphomas or other lymphocyte rich processes may likely also be classified into this class. Loss/partial loss of chromosome 6q (60%) is the most frequent copy number alteration.
DLGNT_1	DLGNT_1	GNT, MAPK	#d1723a	Low-grade glial/glioneuronal/neuroepithelial tumours	diffuse glioneuronal tumours	diffuse leptomeningeal glioneuronal tumour	Diffuse leptomeningeal glioneuronal tumour, subclass 1	The "mc diffuse leptomeningeal glioneuronal tumour (DLGNT), subtype 1" is molecularly characterized by chromosome arm 1p deletion and a mitogen-activated protein kinase (MAPK) pathway gene alteration, most commonly KIAA1549::BRAF fusion. The most frequent initial location is spinal. In the course of the disease dissemination along the leptomeninges is frequent. Supratentorial tumour nodule formation is also possible. Median age is 13 years (range 5 to 39). Typical copy number changes are a loss of 1p (>90%) and occasionally a combined loss of 1p/19q (40%) co-occurring with BRAF duplication (BRAF fusion). IDH1/2 mutations are not observed. Subtype-1 more frequently harbours 1p/19q deletions, occur at lower age  (median 5 years vs 14 years) and are typically cinically less aggressive than subtype-2 DLGNT (PMID29766299).
