Abbrevation_internal	Abbrevation	OPC_molecular_subtype	Color_code	Molecular_superfamily	Molecular_family	Molecular_class	Molecular_subclass	description
ETMR	ETMR_C19MC	ETMR, C19MC-altered	#1693D6	Other CNS embryonal tumours	embryonal tumour with multilayered rosettes	embryonal tumour with multilayered rosettes, C19MC altered	Embryonal tumour with multilayered rosettes, C19MC altered	The "mf Embryonal tumour with multilayered rosettes" is comprised of tumours with the diagnosis embryonal tumour with multilayered rosettes, C19mc-altered (90%) and embryonal tumour with multilayered rosettes, C19mc-non-altered (10%). The majority of tumours are located supratentorially. Median age is 3 years (range 2 to 3). Molecularly, these aggressive tumours frequently harbor amplification of the C19mc miRNA cluster (90%, all cases in the "mc embryonal tumour with multilayered rosettes, C19mc-altered") together with a TTYH1-C19mc fusion. Gain of one copy of chromosome 2 is also frequently observed (>60% of cases), and expression of LIN28A is high at both mRNA and protein levels. In about 10% of cases, tumours with this molecular phenotype but lacking the C19mc amplification may be seen ("mc embryonal tumour with multilayered rosettes, non-c19mc-altered"). These tumours often harbor mutations in DICER1, typically with the first hit in the germline.
EVNCYT	EVNCYT	EVN	#e7b598	Low-grade glial/glioneuronal/neuroepithelial tumours	low-grade glioneuronal tumour	extraventricular neurocytoma	Extraventricular neurocytoma	The "mc Extraventricular neurocytoma" is comprised of usually well-circumscribed neuronal neoplasms of WHO grade II that arises throughout the CNS outside the ventricular system, with histopathological characteristics resembling those of central neurocytoma but demonstrating a much wider morphological spectrum, and with frequent FGFR1::TACC1 fusions. The age peak is in the third to fourth decade of life.
EWS	EWS	EWS	#CE69EC	Mesenchymal, non-meningothelial tumours involving the CNS	Tumours of uncertain differentiation	Ewing sarcoma	Ewing sarcoma	The "mc Ewing sarcoma" of the nervous system is comprised of extraosseous small round cell sarcoma containing a fusion between one FET family gene (usually EWSR1) and one ETS family gene (most often FLI1). Ewing sarcoma is most commonly encountered in children and young adults, with older patients more commonly presenting with extraosseous disease, including in the nervous system.
GBM_CBM	GBM_CBM		#58c159	Adult-type diffuse gliomas	Glioblastoma, IDH-wildtype	high-grade diffuse glioma of the midline/posterior fossa; H3/IDH-wildtype	High-grade diffuse glioma of the midline/posterior fossa; H3/IDH-wildtype	The "mc High-grade diffuse glioma of the midline/posterior fossa; H3/IDH-wildtype (novel)" is comprised of  infiltrative glioma (WHO grade 4) involving the cerebellum.On methylation analysis, this group seems to be distinct from previously identified "hemispheric" infiltrative glioma/glioblastoma subtypes.
GBM_MES_NOS	GBM_MES_ATYP	HGG, H3 wildtype	#518131	Adult-type diffuse gliomas	Glioblastoma, IDH-wildtype	glioblastoma, IDH-wildtype, mesenchymal type	Glioblastoma, IDH-wildtype, [atypical mesenchymal type]	The "mc Glioblastoma, IDH wildtype, subclass mesenchymal, subclass B (novel)" is comprised of tumours with a histological diagnosis of glioblastoma or occasionally gliosarcoma. These tumours are typically located in the cerebral hemispheres with peak incidence in patients aged 55–85 years. Recurrent chromosomal alterations are gain of chromosome 7 with or without EGFR amplification (>80%), loss of 9p21 (CDKN2A/B; >60%) and chromosome 10 loss (>90%). Alterations of NF1 may be enriched in this mc, and expression profiles often resemble the 'Mesenchymal' subgroup according to the TCGA classification.  This subclass is provisional and requires further characterization. There appears to be a certain enrichment for epitheloid GBM and BRAFV600E mutations.
GBM_MES	GBM_MES_TYP	HGG, H3 wildtype	#538533	Adult-type diffuse gliomas	Glioblastoma, IDH-wildtype	glioblastoma, IDH-wildtype, mesenchymal type	Glioblastoma, IDH-wildtype, [typical mesenchymal type]	The "mc Glioblastoma, IDH wildtype, subclass mesenchymal" is comprised of tumours with a histological diagnosis of glioblastoma or occasionally gliosarcoma. These tumours are typically located in the cerebral hemispheres with peak incidence in patients aged 55–85 years. Recurrent chromosomal alterations are gain of chromosome 7 with or without EGFR amplification (>80%), loss of 9p21 (CDKN2A/B; >60%) and chromosome 10 loss (>90%). Alterations of NF1 may be enriched in this mc, and expression profiles often resemble the 'Mesenchymal' subgroup according to the TCGA classification.
HGNET_NOS1	GBM_PNC		#a3bcdc	Adult-type diffuse gliomas	Glioblastoma, IDH-wildtype	glioblastoma, IDH-wildtype, with primitive neuronal component	Glioblastoma, IDH-wildtype, with primitive neuronal component	The "mc Glioblastoma, IDH-wildtype with primitive neuronal component (novel)"  is comprised of diffuse, astrocytic gliomas that are IDH-wildtype and H3-wildtype (CNS WHO grade 4) that histologically also feature a primitive neuronal component. A poorly differentiated phenotype with frequent absence of GFAP expression, high proliferation index and strong staining for p53 and TTF1 often caused misleading histological classification as carcinoma metastasis or primitive neuroectodermal tumour. The median age at diagnosis is around 60 years Clinically, many patients presented with leptomeningeal dissemination and spinal metastasis. These tumours frequently harbor alterations in TP53, RB1 and PTEN, with fewer gains of chromosome 7 and homozygous CDKN2A/B deletions than usually described for IDH-wildtype glioblastoma.
GBM_RTK1	GBM_RTK1	HGG, H3 wildtype	#68C62D	Adult-type diffuse gliomas	Glioblastoma, IDH-wildtype	glioblastoma, IDH-wildtype, RTK1 type	Glioblastoma, IDH-wildtype, RTK1 subtype	The "mc Glioblastoma, IDH-wildtype, RTK1 subtype" is comprised of diffuse, astrocytic gliomas that are IDH-wildtype and H3-wildtype and have one or more of the following histological or genetic features: microvascular proliferation, necrosis, TERT promoter mutation, EGFR gene amplification, +7/−10 chromosome copy-number changes (CNS WHO grade 4). They also very commonly (~90%) harbor TP53 mutations and CDKN2A/B deletions (~70%). They can manifest in patients of any age but preferentially affects older adults, with peak incidence in patients aged 55–85 years. The RTK1 subtype has a lower frequency of EGFR amplification (~25%), while it is enriched for PDGFRA amplification (~30%). Expression profiles often resemble the 'Proneural' subgroup according to the TCGA classification.
GBM_RTK2	GBM_RTK2	HGG, H3 wildtype	#7AF870	Adult-type diffuse gliomas	Glioblastoma, IDH-wildtype	glioblastoma, IDH-wildtype, RTK2 type	Glioblastoma, IDH-wildtype, RTK2 subtype	The "mc Glioblastoma, IDH-wildtype, RTK2 subtype" is comprised of diffuse, astrocytic gliomas that are IDH-wildtype and H3-wildtype and have one or more of the following histological or genetic features: microvascular proliferation, necrosis, TERT promoter mutation, EGFR gene amplification, +7/−10 chromosome copy-number changes (CNS WHO grade 4). They also very commonly (~90%) harbor TP53 mutations and CDKN2A/B deletions (~70%). They can manifest in patients of any age but preferentially affects older adults, with peak incidence in patients aged 55–85 years. The RTK2 subtype harbours a high frequency of EGFR amplification (~60%). Expression profiles often resemble the 'Proneural' subgroup according to the TCGA classification. Expression profiles often resemble the 'Classical' subgroup according to the TCGA classification.
GCT_GERM	GCT_GERM_A		#c39f88	Germ cell tumours	Germ cell tumours of the CNS	Germinoma	Germinoma, subtype KIT wildtype (novel)	The "mc Germinoma, subtype KIT wildtype (novel)" is comprised of morphological and immunophenotypic homologues of gonadal and other extraneuraxial germ cell neoplasms sharing certain genetic features. Approximately 80–90% of CNS germ cell tumours arise in the midline, most frequently in the pineal region followed by the suprasellar compartment (where they originate in the posterior pituitary / infundibular stalk). Bifocal and multifocal examples (nearly all germinomas) typically involve these sites, but they may also occur in the basal ganglia, thalami, or other locations. CNS germ cell tumours principally affect children, and they are more prevalent in eastern Asia than in Europe and the USA. The subtype KIT wildtype includes a spectrum of germinomas mostly without a mutation in KIT.
GCT_GERM_KIT	GCT_GERM_KIT		#b28366	Germ cell tumours	Germ cell tumours of the CNS	Germinoma	Germinoma, subtype KIT mutant (novel)	The "mc Germinoma, subtype KIT mutant (novel)" is comprised of morphological and immunophenotypic homologues of gonadal and other extraneuraxial germ cell neoplasms sharing certain genetic features. Approximately 80–90% of CNS germ cell tumours arise in the midline, most frequently in the pineal region followed by the suprasellar compartment (where they originate in the posterior pituitary / infundibular stalk). Bifocal and multifocal examples (nearly all germinomas) typically involve these sites, but they may also occur in the basal ganglia, thalami, or other locations. CNS germ cell tumours principally affect children, and they are more prevalent in eastern Asia than in Europe and the USA. The subtype KIT mutant is enriched in germinomas harboring a mutation in KIT.
GCT_TERA	GCT_TERA		#996a4d	Germ cell tumours	Germ cell tumours of the CNS	teratoma	Teratoma	The "mc Teratoma" is comprised of tumours consiting of tissue components of the three germ cell layers and occur predominantly in neonates and infants. They arise along the migratory path of primordial germ cells.
GCT_YOLKSAC	GCT_YOLKSAC		#77523c	Germ cell tumours	Germ cell tumours of the CNS	yolk sac tumour	Yolk sac tumour	The "mc Yolk sac tumour" is comprised of malignant neoplasms resembling extraembryonic structures, including yolk sac, allantois, and extraembryonic mesenchyme.
GG	GG	GNG, MAPK	#E4703A	Low-grade glial/glioneuronal/neuroepithelial tumours	low-grade ganglioglial/neuroepithelial tumour	ganglioglioma	Ganglioglioma	The "mc Ganglioglioma" is comprised of well-differentiated, slow-growing glioneuronal neoplasms composed of a combination of neoplastic ganglion and glial cells, which is molecularly characterized by genetic alterations that cause MAPK pathway activation (CNS WHO grade 1).  Histologically, a fraction of these tumours would probably be diagnosed as dysembryoplastic neuroepithelial tumour. Tumours in this group are exclusively located supratentorially. Gangliogliomas have been reported in patients ranging from 0 to 70 years of age, most occurring in the first and second decades of life (median age at diagnosis: 12 years).  Alterations of the MAPK pathway are frequent in this class, and in particular BRAF V600E mutation is highly recurrent. Most cases show a flat profile in copy number analysis, with rare cases showing gain of chromosome 7 and/or X (both in around 20% of cases).
GNT_NOS	GNT_A	GNT	#dd976e	diffuse glioneuronal tumours	diffuse glioneuronal tumours	diffuse glioneuronal tumour, non defined type	Diffuse glioneuronal tumour, subtype A	The "mc glioneuronal tumour, subtype A" is a new methylation class. Pathological , clinical and further molecular evaluation is under investigation.
AAP	HGAP		#734ba9	diffuse glioma, MAPK altered, cell-cycle activated	high-grade astrocytoma with piloid features	high-grade astrocytoma with piloid features	High-grade astrocytoma with piloid features	The "mc high-grade astrocytoma with piloid features" is mainly comprised of tumours with the histological diagnosis of anaplastic pilocytic astrocytoma or less commonly glioblastoma. The tumours mostly occur in the posterior fossa and rarely in the diencephalic/thalamic region; median age is 40 years (age range 24 to 75). Deletions of CDKN2A/B are very frequent (>70%). BRAF duplications are also observed in a fraction of cases. Around 50% of cases show an immunohistochemical loss of ATRX. Loss of chromosome 19q (total or partial) is observed in over 50% of cases
HGNET_NOS2	HGG_B	HGG, H3 wildtype	#7ea2ce	Adult-type diffuse gliomas	diffuse high-grade neuroepithelial tumour [adult-type]	diffuse high-grade neuroepithelial tumour [adult-type, non-defined type B]	Adult-type diffuse high grade glioma, IDH-wildtype, subtype B	The "mc Adult-type diffuse high grade glioma, IDH-wildtype, subtype B (novel)" is comprised of diffuse, astrocytic gliomas that are IDH-wildtype and H3-wildtype (CNS WHO grade 4). This is a provisional methylation cluster for which more specific molecular and clinical associations are currentl lacking.
HGNET_NOS5	HGG_E	HGG, H3 wildtype	#5987c0	Adult-type diffuse gliomas	diffuse high-grade neuroepithelial tumour [adult-type]	diffuse high-grade neuroepithelial tumour [adult-type, non-defined type C]	Adult-type diffuse high grade glioma, IDH-wildtype, subtype E	The "mc Adult-type diffuse high grade glioma, IDH-wildtype, subtype E (novel)" is comprised of diffuse, astrocytic gliomas that are IDH-wildtype and H3-wildtype (CNS WHO grade 4). This is a provisional methylation cluster for which more specific molecular and clinical associations are currentl lacking.
HGNET_NOS6	HGG_F	HGG, H3 wildtype	#3f6da6	Adult-type diffuse gliomas	diffuse high-grade neuroepithelial tumour [adult-type]	diffuse high-grade neuroepithelial tumour [adult-type, non-defined type D]	Adult-type diffuse high grade glioma, IDH-wildtype, subtype F	The "mc Adult-type diffuse high grade glioma, IDH-wildtype, subtype F (novel)" is comprised of diffuse, astrocytic gliomas that are IDH-wildtype and H3-wildtype (CNS WHO grade 4). This is a provisional methylation cluster for which more specific molecular and clinical associations are currentl lacking.
HMB	HMB		#ED5CFC	Mesenchymal, non-meningothelial tumours involving the CNS	Vascular tumours	haemangioblastoma	Haemangioblastoma	The "mc Haemangioblastoma" is comprised of highly vascular tumours containing neoplastic stromal cells that have clear to vacuolated cytoplasm and characteristic immunohistochemical features (e.g. inhibin positivity) and molecular findings (e.g. VHL alterations) (CNS WHO grade 1). DNA copy-number profiles are typically flat. Location is typically in the posterior fossa or spinal; median age is 28 years (range 14 to 66).
IHG	IHG	IHG	#d0bbd8	Paediatric-type diffuse high-grade gliomas	Infant-type hemispheric glioma	Infant-type hemispheric glioma	Infant-type hemispheric glioma	The "mc Infant-type hemispheric glioma" is comprised of cerebral hemispheric, high-grade cellular astrocytomas that arise in early childhood and typically harbor receptor tyrosine kinase (RTK) fusions including those in the NTRK family or in ROS1, ALK, or MET. These gliomas appear in the supratentorial compartment, usually as large masses. The median age at presentation is around 3 months (range: 0–12 months). The prognosis is better than for other pediatric high-grade gliomas. Copy number alterations are scarce.
GBM_LYMPH_HI	INFLAM_ENV		#DBDBDB	Inflammatory microenvironment	Inflammatory microenvironment	Inflammatory microenvironment	Inflammatory microenvironment	The "mc Inflammatory microenvironment" does not represent a distinct tumour class but rather a recurrently observed profile of mixed cell types with a high leukocyte fraction (often predominant granulocytic infiltrates). This is frequently observed in highly necrotic tumours, highly necrotic other tissues or when areas of extensive hemorrhage are sampled along with the tumour tissue of interest. tumours with a pronounced granulocytic infiltrate due to other reasons can also get an elevated score for this class. Classification into this class is not diagnostic for a specific type of tumour. A score for this class indicates that the extracted DNA is likely not suitable for classification by methylation profiling. Depending on the degree, copy number alterations may also be masked by the high leukocyte infiltration. The reference class consists of glioblastomas only, but other tumours with high leukocyte infiltration are also expected to fall into this class.
IO_MEPL	IO_MEPL		#46bcd2	intraocular medulloepithelioma	intraocular medulloepithelioma	intraocular medulloepithelioma	Intraocular medulloepithelioma	The "mc Intraocular medulloepithelioma" is comprised of rare primary embryonal neuroepithelial neoplasms of the eye characterized by cords of multi-layered neuroeopithelial cells resembling the medullary epithelium of the optic cup. Most occur in children, age 2-5 years (range <1-66 years), but rare cases in adults have been reported. In contrast to ETMR, they show no amplification of the C19mc cluster and have a strikingly different DNA methylation pattern compared to these suggesting that the ocular and CNS neoplasms do not share common origins and biological behaviors. They are sometimes associated with somatic and/or germline mutations in DICER1.
LCH	LCH		#4dcc8e	Haematolymphoid tumours involving the CNS	Histiocytic tumours	Langerhans cell histiocytosis	Langerhans cell histiocytosis	The "mc Langerhans cell histiocytosis" comprises manifestations of Langerhans cell histiocytosis. These typically harbour MAPK pathway activating mutations or fusions. Due to the typically mixed composition of cells, scores and sensitivity/specificity for this mc may largely vary. There is s far no sufficient data to determine the specificity of the methylation class for LCH compared to other histiocytoses, e.g. ECD.
LGG_MYB_B	LGG_MYB_B	LGG, MYB/MYBL1	#9c6ae1	Low-grade glial/glioneuronal/neuroepithelial tumours	diffuse glioma, MYB- or MYBL1-altered	diffuse glioma, MYB(L1)-altered, subtype B [infratentorial-type]	Diffuse astrocytoma, MYB or MYBL1-altered, subtype B [infratentorial] (novel)	The "mc diffuse astrocytoma, MYB- or MYBL1-altered" is an infiltrative astroglial neoplasm composed of monomorphic cells with genetic alterations in MYB or MYBL1 (CNS WHO grade 1). Initial methylation data on on this tumour type as reported in PMID 31563982. The mc comprises Subtypes  B, C, and D. Subtyping is so far provisional and under development.
LGG_MYB_C	LGG_MYB_C	LGG, MYB/MYBL1	#6726bf	Low-grade glial/glioneuronal/neuroepithelial tumours	diffuse glioma, MYB- or MYBL1-altered	diffuse glioma, MYB(L1)-altered, subtype C [isomorphic diffuse glioma-type]	Diffuse astrocytoma, MYB or MYBL1-altered, subtype C [isomorphic] (novel)	The "mf diffuse astrocytoma, MYB- or MYBL1-altered" is an infiltrative astroglial neoplasm composed of monomorphic cells with genetic alterations in MYB or MYBL1 (CNS WHO grade 1). Initial methylation data on on this tumour type as reported in PMID 31563982. The mc comprises Subtypes  B, C, and D. Subtyping is so far provisional and under development.
LGG_MYB_D	LGG_MYB_D	LGG, MYB/MYBL1	#501e95	Low-grade glial/glioneuronal/neuroepithelial tumours	diffuse glioma, MYB- or MYBL1-altered	diffuse glioma, MYB(L1)-altered, subtype D	Diffuse astrocytoma, MYB or MYBL1-altered, subtype D (novel)	The "mf diffuse astrocytoma, MYB- or MYBL1-altered" is an infiltrative astroglial neoplasm composed of monomorphic cells with genetic alterations in MYB or MYBL1 (CNS WHO grade 1). Initial methylation data on on this tumour type as reported in PMID 31563982. The mc comprises Subtypes  B, C, and D. Subtyping is so far provisional and under development.
LIPN	LIPN		#DE7B2C	liponeurocytoma	liponeurocytoma	liponeurocytoma	Liponeurocytoma	The "msc Liponeurocytoma" is comprised of tumours with the histological diagnosis liponeurocytoma, a typically cerebellar neoplasm with advanced neuronal or neurocytic differentiation, variable glial differentiation, and focal lipoma-like changes. Focal loss of chromosome 14 (70%) and chromosome 2p (50%) are recurrently observed.
MBg34_I	MB_G34_I	MB, Group3	#bad5f8	Medulloblastoma	medulloblastoma non-WNT/non-SHH activated	medulloblastoma Group 3	Medulloblastoma Group 3, subclass I	The "mc medulloblastoma, subclass Group 3" comprises the subclasses I-IV of the "mf medulloblastoma non-WNT/non-SHH activated" and accordingly represents a subset of the tumor type "medulloblastoma, molecularly defined, non-WNT/non-SHH activated". Overexpression of MYC  and MYC amplification (often with PVT1:MYC fusion) occurs in 17% .GFI1 and GFI1B are overexpressed due to enhancer hijacking in 15%. Chromosome 17 copy-number alterations are found in 55–58% : 17p deletion, 17q gain, or isochromosome 17q. Most frequently mutant/amplified genes in both group 3 and 4 are KDM6A (mutated in 7% of cases), OTX2 (amplified in 6%), ZMYM3 (mutated in 6%), KMT2C (mutated in 6%), KBTBD4 (mutated in 6%), MYCN (amplified in 6%), ZIC1 (mutated in 4%), CDK6 (amplified in 4%), KMT2D (mutated in 3%), and TBR1 (mutated in 3%) {28726821}. Deleterious heterozygous germline mutations in BRCA2 and PALB2 are present in 1–2% of patients. Classic morphology is most frequent in both group 3 and 4, whereas large cell / anaplastic cases are enriched in group 3 subclass II.
MBg34_II	MB_G34_II	MB, Group3	#8bb8f3	Medulloblastoma	medulloblastoma non-WNT/non-SHH activated	medulloblastoma Group 3	Medulloblastoma Group 3, subclass II	The "mc medulloblastoma, subclass Group 3" comprises the subclasses I-IV of the "mf medulloblastoma non-WNT/non-SHH activated" and accordingly represents a subset of the tumor type "medulloblastoma, molecularly defined, non-WNT/non-SHH activated". Overexpression of MYC  and MYC amplification (often with PVT1:MYC fusion) occurs in 17% .GFI1 and GFI1B are overexpressed due to enhancer hijacking in 15%. Chromosome 17 copy-number alterations are found in 55–58% : 17p deletion, 17q gain, or isochromosome 17q. Most frequently mutant/amplified genes in both group 3 and 4 are KDM6A (mutated in 7% of cases), OTX2 (amplified in 6%), ZMYM3 (mutated in 6%), KMT2C (mutated in 6%), KBTBD4 (mutated in 6%), MYCN (amplified in 6%), ZIC1 (mutated in 4%), CDK6 (amplified in 4%), KMT2D (mutated in 3%), and TBR1 (mutated in 3%) {28726821}. Deleterious heterozygous germline mutations in BRCA2 and PALB2 are present in 1–2% of patients. Classic morphology is most frequent in both group 3 and 4, whereas large cell / anaplastic cases are enriched in group 3 subclass II.
MBg34_III	MB_G34_III	MB, Group3	#5d9cee	Medulloblastoma	medulloblastoma non-WNT/non-SHH activated	medulloblastoma Group 3	Medulloblastoma Group 3, subclass III	The "mc medulloblastoma, subclass Group 3" comprises the subclasses I-IV of the "mf medulloblastoma non-WNT/non-SHH activated" and accordingly represents a subset of the tumor type "medulloblastoma, molecularly defined, non-WNT/non-SHH activated". Overexpression of MYC  and MYC amplification (often with PVT1:MYC fusion) occurs in 17% .GFI1 and GFI1B are overexpressed due to enhancer hijacking in 15%. Chromosome 17 copy-number alterations are found in 55–58% : 17p deletion, 17q gain, or isochromosome 17q. Most frequently mutant/amplified genes in both group 3 and 4 are KDM6A (mutated in 7% of cases), OTX2 (amplified in 6%), ZMYM3 (mutated in 6%), KMT2C (mutated in 6%), KBTBD4 (mutated in 6%), MYCN (amplified in 6%), ZIC1 (mutated in 4%), CDK6 (amplified in 4%), KMT2D (mutated in 3%), and TBR1 (mutated in 3%) {28726821}. Deleterious heterozygous germline mutations in BRCA2 and PALB2 are present in 1–2% of patients. Classic morphology is most frequent in both group 3 and 4, whereas large cell / anaplastic cases are enriched in group 3 subclass II.
MBg34_IV	MB_G34_IV	MB, Group3	#2f80ea	Medulloblastoma	medulloblastoma non-WNT/non-SHH activated	medulloblastoma Group 3	Medulloblastoma Group 3, subclass IV	The "mc medulloblastoma, subclass Group 3" comprises the subclasses I-IV of the "mf medulloblastoma non-WNT/non-SHH activated" and accordingly represents a subset of the tumor type "medulloblastoma, molecularly defined, non-WNT/non-SHH activated". Overexpression of MYC  and MYC amplification (often with PVT1:MYC fusion) occurs in 17% .GFI1 and GFI1B are overexpressed due to enhancer hijacking in 15%. Chromosome 17 copy-number alterations are found in 55–58% : 17p deletion, 17q gain, or isochromosome 17q. Most frequently mutant/amplified genes in both group 3 and 4 are KDM6A (mutated in 7% of cases), OTX2 (amplified in 6%), ZMYM3 (mutated in 6%), KMT2C (mutated in 6%), KBTBD4 (mutated in 6%), MYCN (amplified in 6%), ZIC1 (mutated in 4%), CDK6 (amplified in 4%), KMT2D (mutated in 3%), and TBR1 (mutated in 3%) {28726821}. Deleterious heterozygous germline mutations in BRCA2 and PALB2 are present in 1–2% of patients. Classic morphology is most frequent in both group 3 and 4, whereas large cell / anaplastic cases are enriched in group 3 subclass II.
